{
  "approvalId": "recognition-common-2026-08-09-01-7ed32cc-mathieu-fortin-data-paramedic",
  "approvers": {
    "data": "Mathieu Fortin — RxScan Technologies",
    "paramedic": "Mathieu Fortin — RxScan Technologies"
  },
  "candidateSourceCommit": "2b4308de0bc887bd4d8616db2ee5f41c203638a2",
  "collisionCount": 8,
  "consumptionAuthorized": true,
  "files": [
    {
      "bytes": 2139,
      "path": "candidate-manifest.json",
      "sha256": "10d2ce47c678f1cd5bf30bf1e040e4a27e6ecbb3f5f9ab3fc07d6ce26cebc22d"
    },
    {
      "bytes": 7351084,
      "path": "recognition-profile.json",
      "sha256": "70c3c8de5931294e5f74cfdceb7622a41e7e531a71dc164cf835b76b424071a9"
    }
  ],
  "generatedAt": "2026-08-09T14:46:15.442Z",
  "generation": 3,
  "identityCount": 611,
  "manifestSha256": "10d2ce47c678f1cd5bf30bf1e040e4a27e6ecbb3f5f9ab3fc07d6ce26cebc22d",
  "previousReleaseId": "recognition-common-2026-08-01-01",
  "profileSha256": "70c3c8de5931294e5f74cfdceb7622a41e7e531a71dc164cf835b76b424071a9",
  "promotedAt": "2026-08-09T14:54:01.337Z",
  "releaseId": "recognition-common-2026-08-09-01",
  "rollback": {
    "fromReleaseId": null,
    "isRollback": false,
    "reason": null
  },
  "schemaVersion": "1.0.0",
  "sourceCommit": "7ed32cc6a10caf3f44bc8d8c78a18c46474e3560",
  "status": "stable",
  "termCount": 10644
}
